{
  "name": "evidence-lab-core",
  "description": "Agent-first research foundations, fast researcher onboarding, personal skill creation, reproducible pack selection, source verification, citation handling, and scientific critical thinking.",
  "version": "0.15.0",
  "author": {
    "name": "Evidence Lab"
  },
  "keywords": [
    "onboarding",
    "pack-selection",
    "companion-plugin-planning",
    "installation-lifecycle",
    "personal-skill-authoring",
    "paper-lookup",
    "citation-management",
    "critical-thinking"
  ],
  "homepage": "https://github.com/timsmykov/evidence-lab-plugins",
  "repository": "https://github.com/timsmykov/evidence-lab-plugins",
  "license": "MIT",
  "skills": "./skills/",
  "interface": {
    "displayName": "Evidence Lab Core",
    "shortDescription": "Set up a reproducible research workspace.",
    "longDescription": "Runs a short chat onboarding, builds a transparent pack plan, creates portable personal skills, and provides the universal evidence and source-handling foundation.",
    "developerName": "Evidence Lab",
    "category": "Research",
    "capabilities": [
      "Interactive",
      "Research"
    ],
    "defaultPrompt": "Set up Evidence Lab for my research work."
  }
}
