{
  "name": "document-evidence",
  "description": "Reproducible conversion of supported research documents into inspectable Markdown without installing database retrieval or dataset analysis tools.",
  "version": "0.1.0",
  "author": {
    "name": "Evidence Lab"
  },
  "keywords": [
    "document-conversion"
  ],
  "homepage": "https://github.com/timsmykov/evidence-lab-plugins",
  "repository": "https://github.com/timsmykov/evidence-lab-plugins",
  "license": "LicenseRef-Evidence-Lab-Proprietary AND MIT",
  "skills": "./skills/",
  "interface": {
    "displayName": "Document Evidence",
    "shortDescription": "Convert research documents into inspectable evidence.",
    "longDescription": "Converts supported local documents to normalized Markdown while preserving source identity, conversion logs, and visible failures.",
    "developerName": "Evidence Lab",
    "category": "Research",
    "capabilities": [
      "Research",
      "Analyze"
    ],
    "defaultPrompt": "Convert these research documents into evidence I can inspect."
  }
}
