{
  "name": "data-and-pdf",
  "description": "Compatibility entry point for mixed document-and-data projects; installs focused document-evidence and structured-data-analysis packs as dependencies.",
  "version": "1.0.2",
  "author": {
    "name": "Evidence Lab"
  },
  "keywords": [
    "data-and-pdf-compatibility"
  ],
  "homepage": "https://github.com/timsmykov/evidence-lab-plugins",
  "repository": "https://github.com/timsmykov/evidence-lab-plugins",
  "license": "MIT",
  "skills": "./skills/",
  "interface": {
    "displayName": "Data and PDF",
    "shortDescription": "Install document and data workflows together.",
    "longDescription": "Compatibility entry point that installs the focused document-evidence and structured-data-analysis packs together.",
    "developerName": "Evidence Lab",
    "category": "Research",
    "capabilities": [
      "Research",
      "Analyze"
    ],
    "defaultPrompt": "Help me inspect these papers, PDFs, or datasets."
  }
}
