{
  "name": "life-sciences",
  "description": "Domain checks for life-science protocols, biological controls, bias, biosafety boundaries, reporting context, and image acquisition metadata.",
  "version": "0.1.0",
  "author": {
    "name": "Evidence Lab"
  },
  "keywords": [
    "life-science-protocols"
  ],
  "homepage": "https://github.com/timsmykov/evidence-lab-plugins",
  "repository": "https://github.com/timsmykov/evidence-lab-plugins",
  "license": "LicenseRef-Evidence-Lab-Proprietary",
  "skills": "./skills/",
  "interface": {
    "displayName": "Life Sciences",
    "shortDescription": "Add life-science protocol and bias checks.",
    "longDescription": "Adds protocol identity, biological controls, bias, safety boundaries, reporting context, and acquisition metadata to applicable life-science workflows.",
    "developerName": "Evidence Lab",
    "category": "Research",
    "capabilities": [
      "Research",
      "Domain"
    ],
    "defaultPrompt": "Check this life-science study or image workflow for protocol-specific gaps."
  }
}
