{
  "name": "structured-data-analysis",
  "description": "Reproducible public-database retrieval and exploratory analysis for tables and datasets without unrelated document-conversion tooling.",
  "version": "0.2.0",
  "author": {
    "name": "Evidence Lab"
  },
  "keywords": [
    "database-lookup",
    "exploratory-data-analysis"
  ],
  "homepage": "https://github.com/timsmykov/evidence-lab-plugins",
  "repository": "https://github.com/timsmykov/evidence-lab-plugins",
  "license": "MIT",
  "skills": "./skills/",
  "interface": {
    "displayName": "Structured Data Analysis",
    "shortDescription": "Retrieve and inspect structured research data.",
    "longDescription": "Retrieves data from documented public APIs and profiles tables or datasets with explicit quality, missingness, and leakage checks.",
    "developerName": "Evidence Lab",
    "category": "Research",
    "capabilities": [
      "Research",
      "Analyze"
    ],
    "defaultPrompt": "Help me retrieve or inspect this structured research dataset."
  }
}
