{
  "name": "literature-publication",
  "description": "Literature synthesis, evidence-bounded academic writing, editable research diagrams, manuscript review, and source-backed LaTeX venue formatting without installing study-design procedures.",
  "version": "0.4.0",
  "author": {
    "name": "Evidence Lab"
  },
  "keywords": [
    "literature-review",
    "academic-writing",
    "peer-review",
    "research-diagrams",
    "latex-and-venue-formatting"
  ],
  "homepage": "https://github.com/timsmykov/evidence-lab-plugins",
  "repository": "https://github.com/timsmykov/evidence-lab-plugins",
  "license": "MIT AND Apache-2.0",
  "skills": "./skills/",
  "interface": {
    "displayName": "Literature and Publication",
    "shortDescription": "Review literature and prepare a publication.",
    "longDescription": "Supports literature synthesis, evidence-bounded academic writing, editable diagrams, peer review, LaTeX compilation, and source-backed venue validation.",
    "developerName": "Evidence Lab",
    "category": "Research",
    "capabilities": [
      "Research",
      "Write"
    ],
    "defaultPrompt": "Help me review the evidence and prepare this work for publication."
  }
}
